<?xml version="1.0"?>
<!DOCTYPE table SYSTEM "TableModel.dtd">

<table>
	<key-column property-name="id"/>
	<column property-name="tradeId" header-label="Trade">
	</column>
	<column property-name="isin" header-label="Deal">
	</column>
	<column property-name="instrument" header-label="Instrument">
	</column>
	<column property-name="tradeType" header-label="Type">
	</column>
	<column property-name="bookId" header-label="Book">
	</column>
	<column property-name="traderLocation" header-label="Location">
	</column>
	<column property-name="traderId" header-label="Trader">
	</column>
	<column property-name="tradeDate" header-label="Trade time">
		<date-format type="timelong"/>
	</column>
	<column property-name="systemDate" header-label="Amend time">
		<date-format type="timelong"/>
	</column>
</table>
