<?xml version="1.0"?>
<!DOCTYPE table SYSTEM "TableModel.dtd">

<table>
	<column property-name="isin" header-label="ISIN">
	</column>
	<column property-name="sourceSystemCode" header-label="Source system">
		<choice-list list-class="de.westlb.mgb.client.ui.selection_list.SourceSystemList"/>
	</column>
	<column property-name="isinCountryPrefix" header-label="ISIN country prefix">
	</column>
	<column property-name="sourceSystemExchangeId" header-label="Source system exchange ID">
	</column>
	<column property-name="currency" header-label="Currency">
	</column>
	<column property-name="changePending" header-label="Pending change" column-type="boolean">
	</column>
	<column property-name="changeRequestedByName" header-label="Changed by">
	</column>
</table>
