<?xml version="1.0"?>
<!DOCTYPE table SYSTEM "TableModel.dtd">

<table>
	<column property-name="tradeId" header-label="Trade ID">
	</column>
	<column property-name="srcTradeId" header-label="Source Trade ID">
	</column>
	<column property-name="requestId" header-label="Request ID">
	</column>
	<column property-name="requestString" header-label="Request String">
	</column>
	<column property-name="requestDate" header-label="Request Date">
		<date-format type="timelong"/>
	</column>
	<column property-name="instrument" header-label="Instrument">
	</column>
	<column property-name="bookId" header-label="Book">
	</column>
	<column property-name="category" header-label="Category">
	</column>
	<column property-name="summitCategory" header-label="FO Category">
	</column>
	<column property-name="priceCheckCategory" header-label="Price Check Category">
	</column>
	<column property-name="tradePrice" header-label="Trade Price">
		<number-format fraction-min-length="4" fraction-max-length="10" grouping-length="3"/>
	</column>
	<column property-name="theorericalPrice" header-label="Theorerical Price">
		<number-format fraction-min-length="4" fraction-max-length="10" grouping-length="3"/>
	</column>
	<column property-name="theorericalDiff" header-label="Theorerical Difference">
		<number-format fraction-min-length="4" fraction-max-length="10" grouping-length="3"/>
	</column>
	<column property-name="bloombergMinPrice" header-label="Bloomberg Min Price">
		<number-format fraction-min-length="4" fraction-max-length="10" grouping-length="3"/>
	</column>
	<column property-name="bloombergMaxPrice" header-label="Bloomberg Max Price">
		<number-format fraction-min-length="4" fraction-max-length="10" grouping-length="3"/>
	</column>
	<column property-name="bloombergDiff" header-label="Bloomberg Difference">
		<number-format fraction-min-length="4" fraction-max-length="10" grouping-length="3"/>
	</column>
	<column property-name="actualDiff" header-label="Actual Difference">
		<number-format fraction-min-length="4" fraction-max-length="10" grouping-length="3"/>
	</column>
	<column property-name="tolerance" header-label="Tolerance">
		<number-format fraction-min-length="4" fraction-max-length="10" grouping-length="3"/>
	</column>
	<column property-name="isNotExceeded" header-label="OK" column-type="boolean">
	</column>
</table>
